[INFO] Scanning for projects...
[INFO] 
[INFO] --------------------< cs.msu.edu:CSCI_440_Project >---------------------
[INFO] Building CSCI_440_Project 1.0-SNAPSHOT
[INFO] --------------------------------[ jar ]---------------------------------
[INFO] 
[INFO] --- maven-resources-plugin:2.6:resources (default-resources) @ CSCI_440_Project ---
[WARNING] Using platform encoding (UTF-8 actually) to copy filtered resources, i.e. build is platform dependent!
[INFO] Copying 33 resources
[INFO] 
[INFO] --- maven-compiler-plugin:3.1:compile (default-compile) @ CSCI_440_Project ---
[INFO] Nothing to compile - all classes are up to date
[INFO] 
[INFO] --- maven-resources-plugin:2.6:testResources (default-testResources) @ CSCI_440_Project ---
[WARNING] Using platform encoding (UTF-8 actually) to copy filtered resources, i.e. build is platform dependent!
[INFO] skip non existing resourceDirectory /home/carson/Projects/msu/csci-440-fall2021/grading/scripts/repos/joshua_anderson/src/test/resources
[INFO] 
[INFO] --- maven-compiler-plugin:3.1:testCompile (default-testCompile) @ CSCI_440_Project ---
[INFO] Nothing to compile - all classes are up to date
[INFO] 
[INFO] --- maven-surefire-plugin:2.22.1:test (default-test) @ CSCI_440_Project ---
[INFO] 
[INFO] -------------------------------------------------------
[INFO]  T E S T S
[INFO] -------------------------------------------------------
[INFO] Running edu.montana.csci.csci440.model.InvoicesTest
Resetting DB After Test...
Resetting DB After Test...
Resetting DB After Test...
[ERROR] Tests run: 3, Failures: 1, Errors: 0, Skipped: 0, Time elapsed: 0.237 s <<< FAILURE! - in edu.montana.csci.csci440.model.InvoicesTest
[ERROR] testInvoiceFieldsLoad  Time elapsed: 0.205 s  <<< FAILURE!
org.opentest4j.AssertionFailedError: expected: <Stuttgart> but was: <null>
	at edu.montana.csci.csci440.model.InvoicesTest.testInvoiceFieldsLoad(InvoicesTest.java:22)

[INFO] Running edu.montana.csci.csci440.model.ArtistTest
Resetting DB After Test...
artist
[java.lang.Long edu.montana.csci.csci440.model.Artist.artistId, java.lang.String edu.montana.csci.csci440.model.Artist.name]
Resetting DB After Test...
Resetting DB After Test...
Resetting DB After Test...
Resetting DB After Test...
Resetting DB After Test...
[ERROR] Tests run: 6, Failures: 0, Errors: 4, Skipped: 0, Time elapsed: 0.047 s <<< FAILURE! - in edu.montana.csci.csci440.model.ArtistTest
[ERROR] testUpdateWorks  Time elapsed: 0 s  <<< ERROR!
java.lang.UnsupportedOperationException: Needs to be implemented
	at edu.montana.csci.csci440.model.ArtistTest.testUpdateWorks(ArtistTest.java:75)

[ERROR] testCreateWorks  Time elapsed: 0.001 s  <<< ERROR!
java.lang.RuntimeException: org.sqlite.SQLiteException: [SQLITE_ERROR] SQL error or missing database (near "?": syntax error)
	at edu.montana.csci.csci440.model.ArtistTest.testCreateWorks(ArtistTest.java:34)
Caused by: org.sqlite.SQLiteException: [SQLITE_ERROR] SQL error or missing database (near "?": syntax error)
	at edu.montana.csci.csci440.model.ArtistTest.testCreateWorks(ArtistTest.java:34)

[ERROR] testValidationWorks  Time elapsed: 0.003 s  <<< ERROR!
java.lang.UnsupportedOperationException: Needs to be implemented
	at edu.montana.csci.csci440.model.ArtistTest.testValidationWorks(ArtistTest.java:61)

[ERROR] testOptimisticConcurrencyIsImplemented  Time elapsed: 0.03 s  <<< ERROR!
java.lang.UnsupportedOperationException: Needs to be implemented
	at edu.montana.csci.csci440.model.ArtistTest.testOptimisticConcurrencyIsImplemented(ArtistTest.java:49)

[INFO] Running edu.montana.csci.csci440.model.EmployeeTest
Resetting DB After Test...
Resetting DB After Test...
Resetting DB After Test...
Resetting DB After Test...
Resetting DB After Test...
Resetting DB After Test...
Resetting DB After Test...
[ERROR] Tests run: 7, Failures: 3, Errors: 2, Skipped: 0, Time elapsed: 0.141 s <<< FAILURE! - in edu.montana.csci.csci440.model.EmployeeTest
[ERROR] testUpdateWorks  Time elapsed: 0.01 s  <<< ERROR!
java.lang.UnsupportedOperationException: Implement me
	at edu.montana.csci.csci440.model.EmployeeTest.testUpdateWorks(EmployeeTest.java:79)

[ERROR] testCreateWorks  Time elapsed: 0.023 s  <<< FAILURE!
org.opentest4j.AssertionFailedError: expected: <edu.montana.csci.csci440.model.Employee@d1c82101> but was: <null>
	at edu.montana.csci.csci440.model.EmployeeTest.testCreateWorks(EmployeeTest.java:46)

[ERROR] testValidationWorks  Time elapsed: 0.006 s  <<< FAILURE!
org.opentest4j.AssertionFailedError: expected: <3> but was: <2>
	at edu.montana.csci.csci440.model.EmployeeTest.testValidationWorks(EmployeeTest.java:54)

[ERROR] testEmployeeHelperOnlyIssuesOneQuery  Time elapsed: 0.076 s  <<< FAILURE!
org.opentest4j.AssertionFailedError: expected: <true> but was: <false>
	at edu.montana.csci.csci440.model.EmployeeTest.testEmployeeHelperOnlyIssuesOneQuery(EmployeeTest.java:88)

[ERROR] testEmployeeSalesReport  Time elapsed: 0.003 s  <<< ERROR!
java.lang.IndexOutOfBoundsException: Index: 0
	at edu.montana.csci.csci440.model.EmployeeTest.testEmployeeSalesReport(EmployeeTest.java:94)

[INFO] Running edu.montana.csci.csci440.model.TrackTest
Resetting DB After Test...
Resetting DB After Test...
track
[private java.lang.Long edu.montana.csci.csci440.model.Track.trackId, private java.lang.Long edu.montana.csci.csci440.model.Track.albumId, private java.lang.Long edu.montana.csci.csci440.model.Track.mediaTypeId, private java.lang.Long edu.montana.csci.csci440.model.Track.genreId, private java.lang.String edu.montana.csci.csci440.model.Track.name, private java.lang.Long edu.montana.csci.csci440.model.Track.milliseconds, private java.lang.Long edu.montana.csci.csci440.model.Track.bytes, private java.math.BigDecimal edu.montana.csci.csci440.model.Track.unitPrice, public static final java.lang.String edu.montana.csci.csci440.model.Track.REDIS_CACHE_KEY]
Resetting DB After Test...
Resetting DB After Test...
Resetting DB After Test...
Resetting DB After Test...
track
[private java.lang.Long edu.montana.csci.csci440.model.Track.trackId, private java.lang.Long edu.montana.csci.csci440.model.Track.albumId, private java.lang.Long edu.montana.csci.csci440.model.Track.mediaTypeId, private java.lang.Long edu.montana.csci.csci440.model.Track.genreId, private java.lang.String edu.montana.csci.csci440.model.Track.name, private java.lang.Long edu.montana.csci.csci440.model.Track.milliseconds, private java.lang.Long edu.montana.csci.csci440.model.Track.bytes, private java.math.BigDecimal edu.montana.csci.csci440.model.Track.unitPrice, public static final java.lang.String edu.montana.csci.csci440.model.Track.REDIS_CACHE_KEY]
Resetting DB After Test...
Resetting DB After Test...
Resetting DB After Test...
Resetting DB After Test...
Resetting DB After Test...
[ERROR] Tests run: 11, Failures: 5, Errors: 4, Skipped: 0, Time elapsed: 0.073 s <<< FAILURE! - in edu.montana.csci.csci440.model.TrackTest
[ERROR] testAlbumNameIsStoredOnTrack  Time elapsed: 0.001 s  <<< FAILURE!
org.opentest4j.AssertionFailedError: expected: <41> but was: <42>
	at edu.montana.csci.csci440.model.TrackTest.testAlbumNameIsStoredOnTrack(TrackTest.java:96)

[ERROR] testOrderByWorks  Time elapsed: 0.004 s  <<< FAILURE!
org.opentest4j.AssertionFailedError: expected: <É Uma Partida De Futebol> but was: <For Those About To Rock (We Salute You)>
	at edu.montana.csci.csci440.model.TrackTest.testOrderByWorks(TrackTest.java:102)

[ERROR] testDeleteWorks  Time elapsed: 0.006 s  <<< ERROR!
java.lang.RuntimeException: org.sqlite.SQLiteException: [SQLITE_ERROR] SQL error or missing database (near "?": syntax error)
	at edu.montana.csci.csci440.model.TrackTest.testDeleteWorks(TrackTest.java:50)
Caused by: org.sqlite.SQLiteException: [SQLITE_ERROR] SQL error or missing database (near "?": syntax error)
	at edu.montana.csci.csci440.model.TrackTest.testDeleteWorks(TrackTest.java:50)

[ERROR] testTrackListsWorks  Time elapsed: 0.005 s  <<< FAILURE!
org.opentest4j.AssertionFailedError: expected: <3> but was: <0>
	at edu.montana.csci.csci440.model.TrackTest.testTrackListsWorks(TrackTest.java:108)

[ERROR] testUpdateWorks  Time elapsed: 0.004 s  <<< ERROR!
java.lang.UnsupportedOperationException: Needs to be implemented
	at edu.montana.csci.csci440.model.TrackTest.testUpdateWorks(TrackTest.java:77)

[ERROR] testCreateWorks  Time elapsed: 0.018 s  <<< ERROR!
java.lang.RuntimeException: org.sqlite.SQLiteException: [SQLITE_ERROR] SQL error or missing database (near "?": syntax error)
	at edu.montana.csci.csci440.model.TrackTest.testCreateWorks(TrackTest.java:36)
Caused by: org.sqlite.SQLiteException: [SQLITE_ERROR] SQL error or missing database (near "?": syntax error)
	at edu.montana.csci.csci440.model.TrackTest.testCreateWorks(TrackTest.java:36)

[ERROR] testValidationWorks  Time elapsed: 0 s  <<< ERROR!
java.lang.UnsupportedOperationException: Needs to be implemented
	at edu.montana.csci.csci440.model.TrackTest.testValidationWorks(TrackTest.java:61)

[ERROR] trackCountIsCachedInRedis  Time elapsed: 0.001 s  <<< FAILURE!
org.opentest4j.AssertionFailedError: expected: <51> but was: <52>
	at edu.montana.csci.csci440.model.TrackTest.trackCountIsCachedInRedis(TrackTest.java:120)

[ERROR] testArtistNameIsStoredOnTrack  Time elapsed: 0.003 s  <<< FAILURE!
org.opentest4j.AssertionFailedError: expected: <58> but was: <60>
	at edu.montana.csci.csci440.model.TrackTest.testArtistNameIsStoredOnTrack(TrackTest.java:87)

[INFO] Running edu.montana.csci.csci440.model.PlaylistsTest
Resetting DB After Test...
Resetting DB After Test...
Resetting DB After Test...
[ERROR] Tests run: 3, Failures: 1, Errors: 0, Skipped: 0, Time elapsed: 0.001 s <<< FAILURE! - in edu.montana.csci.csci440.model.PlaylistsTest
[ERROR] testPlaylistFieldsLoad  Time elapsed: 0 s  <<< FAILURE!
org.opentest4j.AssertionFailedError: expected: <213> but was: <0>
	at edu.montana.csci.csci440.model.PlaylistsTest.testPlaylistFieldsLoad(PlaylistsTest.java:22)

[INFO] Running edu.montana.csci.csci440.model.AlbumTest
Resetting DB After Test...
Resetting DB After Test...
album
[java.lang.Long edu.montana.csci.csci440.model.Album.albumId, java.lang.Long edu.montana.csci.csci440.model.Album.artistId, java.lang.String edu.montana.csci.csci440.model.Album.title]
Resetting DB After Test...
Resetting DB After Test...
Resetting DB After Test...
[ERROR] Tests run: 5, Failures: 0, Errors: 3, Skipped: 0, Time elapsed: 0.018 s <<< FAILURE! - in edu.montana.csci.csci440.model.AlbumTest
[ERROR] testUpdateWorks  Time elapsed: 0.004 s  <<< ERROR!
java.lang.UnsupportedOperationException: Needs to be implemented
	at edu.montana.csci.csci440.model.AlbumTest.testUpdateWorks(AlbumTest.java:60)

[ERROR] testCreateWorks  Time elapsed: 0.004 s  <<< ERROR!
java.lang.RuntimeException: org.sqlite.SQLiteException: [SQLITE_ERROR] SQL error or missing database (near "?": syntax error)
	at edu.montana.csci.csci440.model.AlbumTest.testCreateWorks(AlbumTest.java:35)
Caused by: org.sqlite.SQLiteException: [SQLITE_ERROR] SQL error or missing database (near "?": syntax error)
	at edu.montana.csci.csci440.model.AlbumTest.testCreateWorks(AlbumTest.java:35)

[ERROR] testValidationWorks  Time elapsed: 0.003 s  <<< ERROR!
java.lang.UnsupportedOperationException: Needs to be implemented
	at edu.montana.csci.csci440.model.AlbumTest.testValidationWorks(AlbumTest.java:45)

[INFO] Running edu.montana.csci.csci440.model.CustomerTest
Resetting DB After Test...
Resetting DB After Test...
Resetting DB After Test...
[ERROR] Tests run: 3, Failures: 1, Errors: 0, Skipped: 0, Time elapsed: 0.004 s <<< FAILURE! - in edu.montana.csci.csci440.model.CustomerTest
[ERROR] testCustomerFieldsLoad  Time elapsed: 0 s  <<< FAILURE!
org.opentest4j.AssertionFailedError: expected: <luisg@embraer.com.br> but was: <null>
	at edu.montana.csci.csci440.model.CustomerTest.testCustomerFieldsLoad(CustomerTest.java:21)

[INFO] 
[INFO] Results:
[INFO] 
[ERROR] Failures: 
[ERROR]   CustomerTest.testCustomerFieldsLoad:21 expected: <luisg@embraer.com.br> but was: <null>
[ERROR]   EmployeeTest.testCreateWorks:46 expected: <edu.montana.csci.csci440.model.Employee@d1c82101> but was: <null>
[ERROR]   EmployeeTest.testEmployeeHelperOnlyIssuesOneQuery:88 expected: <true> but was: <false>
[ERROR]   EmployeeTest.testValidationWorks:54 expected: <3> but was: <2>
[ERROR]   InvoicesTest.testInvoiceFieldsLoad:22 expected: <Stuttgart> but was: <null>
[ERROR]   PlaylistsTest.testPlaylistFieldsLoad:22 expected: <213> but was: <0>
[ERROR]   TrackTest.testAlbumNameIsStoredOnTrack:96 expected: <41> but was: <42>
[ERROR]   TrackTest.testArtistNameIsStoredOnTrack:87 expected: <58> but was: <60>
[ERROR]   TrackTest.testOrderByWorks:102 expected: <É Uma Partida De Futebol> but was: <For Those About To Rock (We Salute You)>
[ERROR]   TrackTest.testTrackListsWorks:108 expected: <3> but was: <0>
[ERROR]   TrackTest.trackCountIsCachedInRedis:120 expected: <51> but was: <52>
[ERROR] Errors: 
[ERROR]   AlbumTest.testCreateWorks:35 » Runtime org.sqlite.SQLiteException: [SQLITE_ERR...
[ERROR]   AlbumTest.testUpdateWorks:60 » UnsupportedOperation Needs to be implemented
[ERROR]   AlbumTest.testValidationWorks:45 » UnsupportedOperation Needs to be implemente...
[ERROR]   ArtistTest.testCreateWorks:34 » Runtime org.sqlite.SQLiteException: [SQLITE_ER...
[ERROR]   ArtistTest.testOptimisticConcurrencyIsImplemented:49 » UnsupportedOperation Ne...
[ERROR]   ArtistTest.testUpdateWorks:75 » UnsupportedOperation Needs to be implemented
[ERROR]   ArtistTest.testValidationWorks:61 » UnsupportedOperation Needs to be implement...
[ERROR]   EmployeeTest.testEmployeeSalesReport:94 » IndexOutOfBounds Index: 0
[ERROR]   EmployeeTest.testUpdateWorks:79 » UnsupportedOperation Implement me
[ERROR]   TrackTest.testCreateWorks:36 » Runtime org.sqlite.SQLiteException: [SQLITE_ERR...
[ERROR]   TrackTest.testDeleteWorks:50 » Runtime org.sqlite.SQLiteException: [SQLITE_ERR...
[ERROR]   TrackTest.testUpdateWorks:77 » UnsupportedOperation Needs to be implemented
[ERROR]   TrackTest.testValidationWorks:61 » UnsupportedOperation Needs to be implemente...
[INFO] 
[ERROR] Tests run: 38, Failures: 11, Errors: 13, Skipped: 0
[INFO] 
[INFO] ------------------------------------------------------------------------
[INFO] BUILD FAILURE
[INFO] ------------------------------------------------------------------------
[INFO] Total time:  3.014 s
[INFO] Finished at: 2021-12-14T11:21:03-07:00
[INFO] ------------------------------------------------------------------------
[ERROR] Failed to execute goal org.apache.maven.plugins:maven-surefire-plugin:2.22.1:test (default-test) on project CSCI_440_Project: There are test failures.
[ERROR] 
[ERROR] Please refer to /home/carson/Projects/msu/csci-440-fall2021/grading/scripts/repos/joshua_anderson/target/surefire-reports for the individual test results.
[ERROR] Please refer to dump files (if any exist) [date].dump, [date]-jvmRun[N].dump and [date].dumpstream.
[ERROR] -> [Help 1]
[ERROR] 
[ERROR] To see the full stack trace of the errors, re-run Maven with the -e switch.
[ERROR] Re-run Maven using the -X switch to enable full debug logging.
[ERROR] 
[ERROR] For more information about the errors and possible solutions, please read the following articles:
[ERROR] [Help 1] http://cwiki.apache.org/confluence/display/MAVEN/MojoFailureException
